### ISSUE TITLE
Support for Hurtworld ?

### ISSUE THREAD

**Issue by UltimateByte** [dgibbs64/linuxgsm#554]
Seems to require some specific options, but should not be very hard to implement. That game seems to be very promising, and unlike Rust, it supports Linux server, even thought it's the same engine. L-O-L.

**Comment by UltimateByte** [comment]
OK, so I tried the server in manual mode, and with the help of some other script that corrects a missing .so file... It's a bit different than source servers of course (Unity engine being used here).

So in case if you're willing to support this game (that has a poor linux support for now, i won't hide it... hopefully they don't do like Rust), here are some infos : 


x64 launcher doesn't work yet.
I had issues getting the console... for now, my tmux session seems empty, even if the log works (at least it gives launching info, but not client actions info) and clients can successfully connect to the server and play.

Standard launch options should look like this : 
tmux new-session -d -s hurtworld '/home/YOUR USER NAME/YOUR INSTALL DIR/Hurtworld.x86 -batchmode -nographics -exec "host 12871;queryport 12881;maxplayers 20;servername Linux Test Server" -logfile "gamelog.txt"'


Some references that helped me : 
http://www.from-beyond.com/?p=526 (nice work from this guy)
http://hurtworld.wikia.com/wiki/Hosting_A_Server (very poor official documentation)

Cheers :beers:

**Comment by dgibbs64** [comment]
Thanks for this. I would be happy to add this when possible. 7 Days to die server is also Unity. If you want you could have a play and see if you can get it running by using the 7 days to die script as a base. It may only be a case of changing the variables. I guarantee this would be released quicker if you can get started and at least get a server running with LGSM. I can tidy up any rough edges such as checking details is correct etc.

**Comment by UltimateByte** [comment]
Cool. Well i'm on it, but i'm experiencing issues trying to keep those quotes into launch options...
I've been struggling for like 2 hours for this ridiculous problem !

So i'm trying it in another empty script...

parms='-batchmode -nographics -exec '"'host ${hostport} ${map} ${save};queryport ${queryport};maxplayers ${maxplayers};servername ${servername};creativemode ${creativemode}'"' -logfile '"'${logfile}'"' '

will return

-batchmode -nographics -exec 'host 12871 ;queryport 12881;maxplayers 20;servername Hurtworld LGSM Server;creativemode 0' -logfile 'gamelog.txt'
test done

So as you can see, it shows ' instead of ".

And
parms='-batchmode -nographics -exec "host ${hostport} ${map} ${save};queryport ${queryport};maxplayers ${maxplayers};servername ${servername};creativemode ${creativemode}" -logfile "${logfile}" '

Will not return the variables...
-batchmode -nographics -exec "host ${hostport} ${map} ${save};queryport ${queryport};maxplayers ${maxplayers};servername ${servername};creativemode ${creativemode}" -logfile "${logfile}"
test done


I need a hand on how to do that !

**Comment by dgibbs64** [comment]
Do you have a fork? I could take a look at it and suggest fixes easily :)
However this may work :)

    parms="-batchmode -nographics -exec \"host ${hostport} ${map} ${save};queryport ${queryport};maxplayers ${maxplayers};servername ${servername};creativemode ${creativemode}\" -logfile \"${logfile}\" "

**Comment by UltimateByte** [comment]
The slash !
I'll try that tonight if i'm not too drunk or too tired when i get home, or tomorrow ! Thanks !

**Comment by UltimateByte** [comment]
OK, the server closes instantly every time, and it makes weird errors when coming to servername.

> host 12871
> queryport 12881
> maxplayers 20
> servername \e[0
> 31mUNAVAILABLE\e[0m
Unknown command: 31munavailable\e[0m
SteamAPI_GameServer.Init() failed.
Closing network connections...
Abort running Threads: 1


It also created this strange empty files at root (31munavailable\e[0m, log, host, queryport, servername... the commands in the end), don't know why.

**Comment by UltimateByte** [comment]
Maybe it's because i've got 2 interfaces and i don't know the command to select the right IP (or maybe it doesn't exist). But i don't think so as i've been able to make this work in standalone.

**Comment by UltimateByte** [comment]
BTW, here is my fork
https://github.com/UltimateByte/linuxgsm/blob/master/Hurtworld/hurtworldserver

**Comment by UltimateByte** [comment]
OK, the fix for this server was copying steamclient.so to serverfiles/Hurtworld_Data/Plugins/x86.
Now i'm able to start it correctly and clients can connect.

BTW, with your command, servername and stuff still fail. I can set it manually and it works thanks to the \" trick.
Now the next issue will be the console...

http://image.noelshack.com/fichiers/2015/51/1450567769-emptyconsole.png

The gamelog.txt shows everything, but the console doesn't.

**Comment by dgibbs64** [comment]
Looks like your having fun :P.

UNAVAILABLE just means that the server name or other variable is not present. Normally not too important.

 I found the same with 7 Days to Die not runing much on console. I wouldnt worry about it. 

@UltimateByte You want to be a collaborator for this project? You do loads of work and help out loads. Seems to make sense you become one.

**Comment by dgibbs64** [comment]
Also I send you a friend request on Steam

**Comment by UltimateByte** [comment]
Let's work on this !

**Comment by Dids91** [comment]
Nice idea ! ;-) 

are you fix hurtworld ?

**Comment by UltimateByte** [comment]
@Dids91 : It's coming soon i guess. It already installs, fixes itself, and runs OK with standard config options.
dgibbs64's gonna have to check a few things, and the script will be released.
If you're in a hurry, you can already try the dev branche if you wish, but expect some missing functions for now (details function is to do, monitor function is to check).
https://github.com/dgibbs64/linuxgsm/tree/hurt-world
Go find the hwserver script, and make a normal install. Note that you're gonna have to update the script un functions manually with the final release when it's out.

The blank console is a normal thing in Hurtworld, they don't provide it.
Maybe it's gonna be accessible with telnet as for 7 Days to Die. We're gonna have to check.
For now you have to use the addadmin STEAMID64 in start parameters (parm="....") and do your admin stuff via the game console.

**Comment by Dids91** [comment]
Thank you for dev branche i love you !

**Comment by UltimateByte** [comment]
Well, i guess it'll be releasable soon.

What works : 
- install
- validate
- start/stop/restart
- monitor
- details
- update

Specific features : 
- Fix for hurtworld server
- You can add admins at start
- You can run the unstable 64 bit launcher for when it eventually gets fixed by Hurtworld's team.

LGSM adds/adaptations :
- don't create a config file
- gsquery working
And i guess that's it.


Remaining on checklist : 
@dgibbs64 
- See if we can use telnet with it as for sdtd. 

To anyone already using it, you can update the script, configure it, then do ./hwserver update-functions , and you should be good to go ! But i recommend you to update it again once it's released so you're back into the main branche.

This is an honor to work on that project, hope it serves you well.

**Comment by Dids91** [comment]
i'm testing branch dev oxide work ! very nice job ;-)

**Comment by UltimateByte** [comment]
@Dids91 
Where did you get your working Oxide version for Linux ?
I'd like to try that too.

**Comment by Dids91** [comment]
yes version linux https://github.com/OxideMod/Snapshots/blob/master/Oxide-Hurtworld_Linux.zip

**Comment by lxalano** [comment]
Hello, your hurtworldserver can use?

**Comment by dgibbs64** [comment]
Found an undefined port.  Any ideas what it is?

Useful port diagnostic command:
netstat -atunp | grep Hurtworld

DESCRIPTION  DIRECTION  PORT   PROTOCOL
> Game/RCON  INBOUND    12871  udp
> Query      INBOUND    12881  udp


Status: ONLINE

admin@lgsm-ubuntu-14:~/lgsm/hwserver$ netstat -atunp | grep Hurtworld
(Not all processes could be identified, non-owned process info
 will not be shown, you would have to be root to see it all.)
udp        0      0 0.0.0.0:12871           0.0.0.0:*                           25587/Hurtworld.x86
udp        0      0 0.0.0.0:12881           0.0.0.0:*                           25587/Hurtworld.x86
udp        0      0 0.0.0.0:4260            0.0.0.0:*                           25587/Hurtworld.x86

**Comment by UltimateByte** [comment]
That's weird. No idea, i'll do the same test and eventually ask ask the devs when i go back home in a few days. I may also try to run several servers to see if this port changes to avoid a conflict. We could also watch the traffic on this port to see who it communicated with.

**Comment by dgibbs64** [comment]
Further notes. Hurtworkd requires Glibc 2.15. Testing a glibcfix would be useful

**Comment by UltimateByte** [comment]
@dgibbs64  What distros aren't updated to glibc 2.15+ yet ?

**Comment by dgibbs64** [comment]
I should really create a list for this :P https://github.com/dgibbs64/linuxgsm/wiki/Glibc#disto-glibc-versions

**Comment by UltimateByte** [comment]
Conclusion : Update your server OS to avoid problems. :p 
Can i let you look out this glibc fix as i have no idea how it works ?

**Comment by UltimateByte** [comment]
So, about that ghost port...

One server running : 
serverdev@lrob:~/hurtworld/functions$ netstat -atunp | grep Hurtworld
(Not all processes could be identified, non-owned process info
 will not be shown, you would have to be root to see it all.)
udp        0      0 0.0.0.0:1535            0.0.0.0:*                           4737/Hurtworld.x86
udp        0      0 0.0.0.0:12871           0.0.0.0:*                           4737/Hurtworld.x86
udp        0      0 0.0.0.0:12881           0.0.0.0:*                           4737/Hurtworld.x86

Two servers running : 
[  OK  ] Starting hurtworld-server: Hurtworld LGSM Server
serverdev@lrob:~/hwserver$ netstat -atunp | grep Hurtworld
(Not all processes could be identified, non-owned process info
 will not be shown, you would have to be root to see it all.)
udp        0      0 0.0.0.0:2982            0.0.0.0:*                           17593/Hurtworld.x86
udp        0      0 0.0.0.0:4472            0.0.0.0:*                           17805/Hurtworld.x86
udp        0      0 0.0.0.0:12871           0.0.0.0:*                           17593/Hurtworld.x86
udp        0      0 0.0.0.0:12872           0.0.0.0:*                           17805/Hurtworld.x86
udp        0      0 0.0.0.0:12881           0.0.0.0:*                           17593/Hurtworld.x86
udp        0      0 0.0.0.0:12882           0.0.0.0:*                           17805/Hurtworld.x86

That port changes every single time, it's totally random. I don't know what it's used for.
Should i ask the game devs ?

**Comment by dgibbs64** [comment]
Yeah may be worth contacting them to so we know what its for.

**Comment by UltimateByte** [comment]
Asked there as it seems to be the best place to get devs : https://www.reddit.com/r/hurtworld/comments/3z9l1m/hurtworld_unbound_port_in_linux_server/
Waiting for an answerµ.

**Comment by dgibbs64** [comment]
Awesome hopefully we get the info.

**Comment by UltimateByte** [comment]
Also posted here http://www.hostedredmine.com/issues/507370

**Comment by UltimateByte** [comment]
Here is the kind of things i get while tcpdumping this mysterious port : 

root@lrob:/home/serverdev/hwserver# tcpdump port 3162 and '(tcp-syn|tcp-ack)!=0'
tcpdump: verbose output suppressed, use -v or -vv for full protocol decode
listening on eth0, link-type EN10MB (Ethernet), capture size 262144 bytes
03:52:32.564560 IP lrob.3162 > 162-254-196-41.valve.net.27017: UDP, length 84
03:52:32.924189 IP 162-254-196-41.valve.net.27017 > lrob.3162: UDP, length 36
03:52:41.597250 IP lrob.3162 > 162-254-196-41.valve.net.27017: UDP, length 84
03:52:50.629852 IP lrob.3162 > 162-254-196-41.valve.net.27017: UDP, length 84
03:52:59.662648 IP lrob.3162 > 162-254-196-41.valve.net.27017: UDP, length 84
03:53:00.071290 IP 162-254-196-41.valve.net.27017 > lrob.3162: UDP, length 36

The only thing i can think of is server registration onto their server list, but i'm not so sure why it's not using the port set in config... And btw, anyone using a firewall would block that crap and complain not to be registered on their server list.

**Comment by dgibbs64** [comment]
Im happy to close this as it doesn't appear we are getting an answer. However if the info becomes available in the future we can add it in

**Comment by UltimateByte** [comment]
Yep, let's close it and update if info end up coming :)

**Comment by JonathanPorta** [comment]
I was able to get the Hurtworld 32-bit server running fine in a Docker container. I am only exposing two ports and have no issues with EAC or with having multiple clients connect.

If interested, here is the [Dockerfile](https://github.com/JonathanPorta/ogs-dockerfiles/blob/master/hurtworld/Dockerfile) and [start script](https://github.com/JonathanPorta/ogs-dockerfiles/blob/master/hurtworld/init.sh).

And when I run the container I map the ports like so:
```
docker run\
        --net="host"\
        -v $(pwd)/logs:/logs/\
        -p 12871:12871/udp\
        -p 12881:12881/udp\
        -it jonathanporta/ogs-hurtworld -exec "host 12871;queryport 12881;servername [ogs] HurtCoast|Wiped 1/3|" -logfile "/logs/gamelog.txt"
```

**Comment by UltimateByte** [comment]
@JonathanPorta A pleasure to see you here !
(I'm sorry about that Steam "conversation", i didn't see this post yet and didn't know you under your nickname... I have quite a few people adding me with apparently no reason so I can be pretty expeditious.)

Thanks for upvoting, hopefully it gets some attention but i'm losing hope.

I'm not familiar with Dockerfiles btw, but i will try another standalone server (without LGSM) to see if something (tmux ?!) could happen to add another listening port. Because otherwise your start options are similar to LGSM ones !

Maybe it could be relevant : What distro are you using ?

**Comment by JonathanPorta** [comment]
@UltimateByte Heh, no worries. I accepted your request now. :+1: 

It's probably worth mentioning: I can't get the x86_64 version to run at all, but the 32bit version runs just fine. No idea why that is. I think it was compiled incorrectly. I have seen a couple of other people stating the same issue without a fix.

If you aren't familiar with Docker or Linux containers (Docker containers are Linux containers) you can, and I know someone will shoot me for saying this, think of them as super small and efficient VMs. Each one runs it's one Linux distro. I am using a lightweight cut of debian that's been slimmed down to just the basics. Essentially you run one process per container. So, basically it's just the server binary running in the container.

The cool thing about containers, including Docker containers, is that you are nearly guaranteed the same experience regardless of where it is running. So, if the server runs great on your laptop, it will run great on anyone else's laptop or server. Containerizing an application removes a large number of variables.

It also lets you fully role up the dependencies into a packaged binary format. No more installing shit at run time. It's already done when you build the container. And since it is a binary artifact you don't have to worry about missing any dependencies like you normally would if you ran around installing things on servers.

**Comment by UltimateByte** [comment]
@JonathanPorta Well thanks a lot for this clarification !
That Docker hting seems very interesting ! I'll have a look at the syntax and the usage then :)
Just one question that i can't answer myself right now : Did you get the supplementary port to be removed by not allowing it into the Docker, or is the simple fact of running the server into a docker enough to have it behave differently ?

**Comment by hyperbolic2346** [comment]
Docker requires that you specifically list the ports that are open on the container. Simply not including the other random port means no incoming connections can happen.

I'm running both hurtworld and insurgency in docker containers as well and I highly recommend it for certain setups. It is more work to get things going, but you don't have to worry about things randomly breaking due to dependencies changing or something.

**Comment by UltimateByte** [comment]
@hyperbolic2346 Thanks for the info. So that means the server will have a random port listening anyway, it's just a way to block it. :)
I personally didn't any game server breaking after updating my packages after 2 years of using Debian (7 and 8), but i can definitely feel how useful it could be for CentOS users for example.

**Comment by hyperbolic2346** [comment]
Yeah, it's something that crops up on occasion like needing a different version of tmux I saw recently, but overall unless you have a compelling reason to need the modularity I doubt it would be worth it. I'm running my servers on a cluster. I need to be able to push the container to any machine on the cluster and have it just work. That makes the container approach very appealing to me.

**Comment by UltimateByte** [comment]
Closing this, as the script is fully working, and this remaining thing is a non fixable game issue.

**Comment by Aftek** [comment]
> Closing this, as the script is fully working
nope, still not working out of the box :'(

`[ FAIL ] Starting hurtworld-server: Unable to start Hurtworld LGSM Server`

Nothing in the logs... only:
```
Console logging disabled: Bug in tmux 1.8 breaks logging
http://gameservermanagers.com/tmux-upgrade
Currently installed: tmux 1.8
```
which I did, and now i'm getting empty logs.

I'll try without `./hwserver` in a new container, see if it has anything to do with it, or just my current setup.

**Comment by UltimateByte** [comment]
Can you please copy that into a new issue ?

**Comment by Aftek** [comment]
@UltimateByte thanks for following up on closed issues too :)
Otherwise done! #772

**Comment by xcoce** [comment]
Hello and help please
How u fixed this ?
running LGSM linux hurtworld server and get this in log:

SteamAPI_GameServer.Init() failed.
Closing network connections…
Abort running Threads: 1
Setting up 1 worker threads for Enlighten.
Thread -> id: e10e6b40 -> priority: 1
Unloaded all mods

if debbuging by command ./hwserver debug
then i get this:
[ INFO ] Stopping hurtworld-server: hurt.7worlds.ru is already stopped
[ OK ] Debug hurtworld-server: Starting debug
Set current directory to /home/hwserver/serverfiles
Found path: /home/hwserver/serverfiles/Hurtworld.x86

**Comment by UltimateByte** [comment]
@xcoce Please, make your own topic into the steam group for general help, and provide some real information, following those instructions : http://steamcommunity.com/groups/linuxgsm/discussions/0/458604254471755996/
